number,value,datetime_start,datetime_complete,duration,params_batch_size,params_dropout_rate,params_lr,params_n_layers,params_n_units_l0,params_n_units_l1,params_n_units_l2,params_n_units_l3,params_n_units_l4,params_n_units_l5,params_optimizer,params_weight_decay,user_attrs_best_epoch,user_attrs_best_val_mae,user_attrs_model_params,state
376,1647.2386474609375,2026-03-24 01:38:18.179554,2026-03-24 01:38:25.470888,0 days 00:00:07.291334,64,0.05928513686536248,0.042684415267001424,3,17,55,24.0,,,,SGD,6.131519999459711e-05,95.0,1647.2386474609375,2704.0,COMPLETE
377,1557.80126953125,2026-03-24 01:38:25.487559,2026-03-24 01:38:32.808385,0 days 00:00:07.320826,64,0.005213219827929099,0.04728348981054078,5,26,62,27.0,27.0,39.0,,SGD,7.097779397215503e-05,66.0,1557.80126953125,5859.0,COMPLETE
378,1410.843505859375,2026-03-24 01:38:32.826546,2026-03-24 01:38:54.424530,0 days 00:00:21.597984,64,0.008831749596690712,0.07178382450599248,6,14,58,21.0,10.0,42.0,42.0,SGD,3.0428695716602615e-05,255.0,1410.843505859375,5140.0,COMPLETE
379,1559.9486083984375,2026-03-24 01:38:54.447790,2026-03-24 01:39:20.449103,0 days 00:00:26.001313,32,0.0016052522154282043,0.03132624088098546,5,31,52,9.0,39.0,34.0,,SGD,4.033027080659021e-05,208.0,1559.9486083984375,4535.0,COMPLETE
380,1546.68212890625,2026-03-24 01:39:20.472464,2026-03-24 01:39:29.597763,0 days 00:00:09.125299,64,0.006837390770107768,0.052067623775581905,4,20,60,18.0,40.0,,,SGD,3.6676910006302476e-05,106.0,1546.68212890625,3615.0,COMPLETE
381,1326.6778564453125,2026-03-24 01:39:29.615612,2026-03-24 01:39:50.367225,0 days 00:00:20.751613,64,0.010545701257124316,0.04576812473662951,4,22,59,23.0,34.0,,,SGD,5.085757545889077e-05,299.0,1326.6778564453125,4062.0,COMPLETE
382,1401.7996826171875,2026-03-24 01:39:50.387498,2026-03-24 01:40:03.235087,0 days 00:00:12.847589,64,0.01337726259013534,0.04609802864974842,3,22,59,23.0,,,,SGD,5.4054489106647044e-05,194.0,1401.7996826171875,3167.0,COMPLETE
383,1437.8291015625,2026-03-24 01:40:03.256581,2026-03-24 01:40:12.557741,0 days 00:00:09.301160,64,0.01143617981647825,0.04390849277526239,4,23,61,26.0,35.0,,,SGD,5.072980920618107e-05,109.0,1437.8291015625,4554.0,COMPLETE
384,2008.62841796875,2026-03-24 01:40:12.577666,2026-03-24 01:40:25.988704,0 days 00:00:13.411038,16,0.0144659197406239,0.04209764943002416,4,22,59,25.0,34.0,,,SGD,4.412075780204031e-05,,,,PRUNED
385,1858.062255859375,2026-03-24 01:40:26.003951,2026-03-24 01:40:30.097542,0 days 00:00:04.093591,64,0.010951408965180634,0.049932352272132975,2,24,60,,,,,SGD,4.608129052907401e-05,,,,PRUNED
386,1534.542236328125,2026-03-24 01:40:30.112701,2026-03-24 01:40:39.059931,0 days 00:00:08.947230,64,0.009694176302998231,0.04625778974130368,3,27,58,23.0,,,,SGD,4.9882216821487394e-05,124.0,1534.542236328125,3464.0,COMPLETE
387,1452.2384033203125,2026-03-24 01:40:39.078033,2026-03-24 01:40:58.307257,0 days 00:00:19.229224,64,0.008269828954371884,0.06556686505081058,4,21,8,21.0,32.0,,,SGD,2.6597526006424604e-05,285.0,1452.2384033203125,1455.0,COMPLETE
388,1477.14208984375,2026-03-24 01:40:58.328921,2026-03-24 01:41:10.128362,0 days 00:00:11.799441,64,0.04382470074549358,0.048698250176468116,4,24,61,19.0,34.0,,,SGD,6.096243770478925e-05,154.0,1477.14208984375,3910.0,COMPLETE
389,1455.2537841796875,2026-03-24 01:41:10.150849,2026-03-24 01:41:24.797140,0 days 00:00:14.646291,64,0.010760749900377533,0.045697448190953706,4,28,57,24.0,33.0,,,SGD,0.000793683285783797,194.0,1455.2537841796875,4440.0,COMPLETE
390,1460.8199462890625,2026-03-24 01:41:24.815678,2026-03-24 01:41:35.523427,0 days 00:00:10.707749,64,0.007130416048150388,0.05104161652973217,5,29,35,20.0,33.0,38.0,,SGD,4.200177041988192e-05,116.0,1460.8199462890625,4365.0,COMPLETE
391,1437.9791259765625,2026-03-24 01:41:35.540369,2026-03-24 01:41:45.397982,0 days 00:00:09.857613,64,0.0032675642538196195,0.056994089813720665,5,25,59,17.0,35.0,40.0,,RMSprop,3.280732650741921e-05,72.0,1437.9791259765625,5242.0,COMPLETE
392,1466.4119873046875,2026-03-24 01:41:45.416161,2026-03-24 01:41:54.913595,0 days 00:00:09.497434,64,0.00590903956741243,0.05353244779851087,5,21,62,22.0,43.0,37.0,,SGD,5.255611796650414e-05,92.0,1466.4119873046875,5964.0,COMPLETE
393,1475.601318359375,2026-03-24 01:41:54.934455,2026-03-24 01:42:05.277590,0 days 00:00:10.343135,64,0.008362788859962434,0.07345524091880246,5,23,63,26.0,17.0,43.0,,SGD,7.647037298015428e-05,111.0,1475.601318359375,5004.0,COMPLETE
394,1439.05419921875,2026-03-24 01:42:05.299060,2026-03-24 01:42:12.369009,0 days 00:00:07.069949,64,0.001539595228382224,0.08107182458112493,3,34,59,23.0,,,,SGD,3.69705554162526e-05,78.0,1439.05419921875,4007.0,COMPLETE
395,2736.661865234375,2026-03-24 01:42:12.387683,2026-03-24 01:42:14.901743,0 days 00:00:02.514060,64,0.01259845365775902,0.04755152097198257,5,25,56,19.0,32.0,41.0,,Adam,4.752065037007451e-05,,,,PRUNED
396,1571.38671875,2026-03-24 01:42:14.918070,2026-03-24 01:42:21.528838,0 days 00:00:06.610768,64,0.0038819307974421106,0.0551794487530147,5,26,49,16.0,57.0,45.0,,SGD,5.719991185320996e-05,49.0,1571.38671875,6368.0,COMPLETE
397,1474.912841796875,2026-03-24 01:42:21.553023,2026-03-24 01:42:33.139536,0 days 00:00:11.586513,64,0.00989037643657176,0.04883322253143559,5,22,58,22.0,37.0,43.0,,SGD,4.0123570724708245e-05,128.0,1474.912841796875,5723.0,COMPLETE
398,1527.7001953125,2026-03-24 01:42:33.159546,2026-03-24 01:42:42.894480,0 days 00:00:09.734934,64,0.005891295218611686,0.044724769973110166,6,27,61,21.0,30.0,41.0,64.0,SGD,3.4325380610429506e-05,78.0,1527.7001953125,8425.0,COMPLETE
399,1425.30224609375,2026-03-24 01:42:42.914508,2026-03-24 01:43:06.036859,0 days 00:00:23.122351,32,0.0031283834166090643,0.050741539180658615,5,24,50,25.0,40.0,39.0,,SGD,2.8771066507465126e-05,185.0,1425.30224609375,5776.0,COMPLETE
400,1470.9085693359375,2026-03-24 01:43:06.057517,2026-03-24 01:43:17.676061,0 days 00:00:11.618544,64,0.0003347828447611617,0.041588735532055075,3,19,60,24.0,,,,SGD,2.42576736544012e-05,171.0,1470.9085693359375,3066.0,COMPLETE
401,1542.29541015625,2026-03-24 01:43:17.697786,2026-03-24 01:43:25.430810,0 days 00:00:07.733024,64,0.028439548098483827,0.06225735704434272,4,39,57,18.0,47.0,,,SGD,4.521194645229829e-05,74.0,1542.29541015625,4938.0,COMPLETE
402,1328.65380859375,2026-03-24 01:43:25.451406,2026-03-24 01:43:41.133026,0 days 00:00:15.681620,64,0.007349996208726348,0.07470521991941063,5,23,52,19.0,36.0,44.0,,SGD,4.0083484693628504e-05,194.0,1328.65380859375,5203.0,COMPLETE
403,1392.46142578125,2026-03-24 01:43:41.152257,2026-03-24 01:43:51.666631,0 days 00:00:10.514374,64,0.00885869125638645,0.07493573251146349,4,22,51,18.0,36.0,,,SGD,4.218847413212135e-05,132.0,1392.46142578125,3282.0,COMPLETE
404,1497.7572021484375,2026-03-24 01:43:51.684542,2026-03-24 01:44:02.965513,0 days 00:00:11.280971,64,0.007349367068174151,0.06960078153938892,4,20,52,16.0,36.0,,,SGD,4.9443509519279145e-05,144.0,1497.7572021484375,3017.0,COMPLETE
405,2876.50439453125,2026-03-24 01:44:02.984534,2026-03-24 01:44:04.742510,0 days 00:00:01.757976,64,0.011501690984806304,0.020833828855595878,4,23,53,20.0,20.0,,,SGD,4.012068456364104e-05,,,,PRUNED
406,1750.5030517578125,2026-03-24 01:44:04.757484,2026-03-24 01:44:17.448184,0 days 00:00:12.690700,16,0.014963111005777416,0.0710065846635218,4,32,51,19.0,37.0,,,SGD,5.37168034079354e-05,35.0,1750.5030517578125,4015.0,COMPLETE
407,1524.3035888671875,2026-03-24 01:44:17.464312,2026-03-24 01:44:25.692986,0 days 00:00:08.228674,64,0.007087038022803011,0.07392127394621391,4,21,52,27.0,23.0,,,SGD,0.00044877566918821986,93.0,1524.3035888671875,3678.0,COMPLETE
408,1433.881103515625,2026-03-24 01:44:25.715498,2026-03-24 01:44:36.195283,0 days 00:00:10.479785,64,0.009690091405310554,0.07950753899926159,5,10,50,20.0,12.0,46.0,,SGD,4.4819682561655334e-05,111.0,1433.881103515625,2833.0,COMPLETE
409,1527.1546630859375,2026-03-24 01:44:36.211922,2026-03-24 01:44:45.161282,0 days 00:00:08.949360,64,0.005651928599237982,0.0754180114551101,5,29,53,18.0,26.0,55.0,,SGD,6.836417392470657e-05,91.0,1527.1546630859375,5220.0,COMPLETE
410,1450.3218994140625,2026-03-24 01:44:45.180180,2026-03-24 01:44:57.469755,0 days 00:00:12.289575,64,0.008134434603388073,0.06765067391071732,5,20,63,22.0,35.0,44.0,,SGD,9.400361657789345e-05,142.0,1450.3218994140625,5713.0,COMPLETE
411,1604.47998046875,2026-03-24 01:44:57.490245,2026-03-24 01:45:09.728450,0 days 00:00:12.238205,64,0.005290377949425094,0.07698773009244564,5,8,55,24.0,42.0,44.0,,RMSprop,3.1981046367290627e-05,96.0,1604.47998046875,5244.0,COMPLETE
412,2437.045166015625,2026-03-24 01:45:09.749081,2026-03-24 01:45:11.617213,0 days 00:00:01.868132,64,0.0043420550970410515,0.03945924451095502,4,23,51,17.0,39.0,,,SGD,3.6306217412011945e-05,,,,PRUNED
413,1429.4837646484375,2026-03-24 01:45:11.631311,2026-03-24 01:45:20.481568,0 days 00:00:08.850257,64,0.006843362501592354,0.07230115296568564,5,22,54,25.0,37.0,36.0,,SGD,1.5179182899777045e-05,90.0,1429.4837646484375,5530.0,COMPLETE
414,1391.2047119140625,2026-03-24 01:45:20.498109,2026-03-24 01:45:34.426224,0 days 00:00:13.928115,64,0.004278545958040218,0.04476923217941011,5,24,53,23.0,56.0,64.0,,SGD,3.8947660243216604e-05,157.0,1391.2047119140625,8280.0,COMPLETE
415,1361.5118408203125,2026-03-24 01:45:34.447251,2026-03-24 01:45:50.227212,0 days 00:00:15.779961,64,0.008543668798348315,0.05619227715003786,5,42,49,20.0,41.0,45.0,,SGD,4.692669588719337e-05,185.0,1361.5118408203125,6676.0,COMPLETE
416,1427.261962890625,2026-03-24 01:45:50.250528,2026-03-24 01:46:02.807148,0 days 00:00:12.556620,64,0.006343867811397541,0.05741596881326843,5,42,46,19.0,49.0,48.0,,SGD,4.7295875386105035e-05,139.0,1427.261962890625,7086.0,COMPLETE
417,2766.570068359375,2026-03-24 01:46:02.830753,2026-03-24 01:46:05.044361,0 days 00:00:02.213608,64,0.0032248517577970225,0.055571361187437586,4,19,47,21.0,45.0,,,Adam,2.0085423251420936e-05,,,,PRUNED
418,1476.1676025390625,2026-03-24 01:46:05.060502,2026-03-24 01:46:17.925565,0 days 00:00:12.865063,64,0.007858116293167254,0.05984015862026432,5,44,48,20.0,38.0,45.0,,SGD,5.7859180989629055e-05,146.0,1476.1676025390625,6525.0,COMPLETE
419,1408.244140625,2026-03-24 01:46:17.944043,2026-03-24 01:46:33.845195,0 days 00:00:15.901152,64,0.02116890830716307,0.053327447448838446,5,42,49,19.0,41.0,47.0,,SGD,5.0497447139652196e-05,190.0,1408.244140625,6673.0,COMPLETE
420,1529.1605224609375,2026-03-24 01:46:33.865194,2026-03-24 01:46:46.620967,0 days 00:00:12.755773,64,0.08807432473386839,0.057054557162655346,5,35,49,21.0,36.0,45.0,,SGD,4.299190731762367e-05,144.0,1529.1605224609375,6004.0,COMPLETE
421,1546.9947509765625,2026-03-24 01:46:46.639682,2026-03-24 01:47:00.619185,0 days 00:00:13.979503,32,0.004972467593424743,0.06989742649709378,5,42,18,18.0,34.0,33.0,,SGD,4.701887728022224e-05,93.0,1546.9947509765625,3619.0,COMPLETE
422,1578.5733642578125,2026-03-24 01:47:00.636716,2026-03-24 01:47:06.063524,0 days 00:00:05.426808,64,0.002638403989810031,0.05398176669971765,5,37,48,20.0,39.0,50.0,,SGD,5.498814301780888e-05,30.0,1578.5733642578125,6395.0,COMPLETE
423,1514.6807861328125,2026-03-24 01:47:06.085447,2026-03-24 01:47:17.366907,0 days 00:00:11.281460,64,0.0059300289393375855,0.05571583477579164,5,41,61,16.0,18.0,42.0,,SGD,4.128235483457169e-05,108.0,1514.6807861328125,5426.0,COMPLETE
424,1439.4024658203125,2026-03-24 01:47:17.388429,2026-03-24 01:47:29.167532,0 days 00:00:11.779103,64,0.009270362581889874,0.05259255847800638,4,21,41,14.0,24.0,,,SGD,3.39887964124055e-05,159.0,1439.4024658203125,2264.0,COMPLETE
425,1595.1412353515625,2026-03-24 01:47:29.191527,2026-03-24 01:47:35.787204,0 days 00:00:06.595677,64,0.003938643319297122,0.05630873799645199,5,43,50,21.0,40.0,43.0,,SGD,8.067885693058441e-05,45.0,1595.1412353515625,6739.0,COMPLETE
426,1414.1717529296875,2026-03-24 01:47:35.808155,2026-03-24 01:47:44.395545,0 days 00:00:08.587390,64,0.0015689262448444854,0.0596946855996156,5,23,60,17.0,60.0,40.0,,SGD,4.334533677723246e-05,73.0,1414.1717529296875,6645.0,COMPLETE
427,1386.981689453125,2026-03-24 01:47:44.411179,2026-03-24 01:47:58.828907,0 days 00:00:14.417728,64,0.007797556590619864,0.054328268770216646,5,39,51,23.0,38.0,49.0,,SGD,3.831932784291382e-05,172.0,1386.981689453125,6860.0,COMPLETE
428,1459.2093505859375,2026-03-24 01:47:58.850091,2026-03-24 01:48:12.268802,0 days 00:00:13.418711,64,0.011237037785103569,0.051614130526931076,5,44,14,19.0,35.0,45.0,,SGD,2.9860494020641024e-05,161.0,1459.2093505859375,3991.0,COMPLETE
429,2390.107666015625,2026-03-24 01:48:12.296537,2026-03-24 01:48:17.047033,0 days 00:00:04.750496,16,0.06632393420638863,0.09681809779458866,4,46,62,22.0,22.0,,,SGD,5.259551877844313e-05,,,,PRUNED
430,1558.1651611328125,2026-03-24 01:48:17.068461,2026-03-24 01:48:28.537683,0 days 00:00:11.469222,64,9.206526097985069e-05,0.07425069950644048,5,24,64,20.0,37.0,46.0,,SGD,3.502413846962956e-05,122.0,1558.1651611328125,6070.0,COMPLETE
431,1427.76513671875,2026-03-24 01:48:28.557057,2026-03-24 01:48:42.962937,0 days 00:00:14.405880,64,0.005108670222891045,0.07769836967466726,5,40,59,22.0,41.0,35.0,,SGD,4.73281119187433e-05,144.0,1427.76513671875,6942.0,COMPLETE
432,1435.9801025390625,2026-03-24 01:48:42.980987,2026-03-24 01:48:58.392682,0 days 00:00:15.411695,64,0.006812534798587652,0.04992415175371982,5,17,56,19.0,61.0,38.0,,SGD,5.906980451866468e-05,172.0,1435.9801025390625,6241.0,COMPLETE
433,1478.629638671875,2026-03-24 01:48:58.410454,2026-03-24 01:49:06.620945,0 days 00:00:08.210491,64,0.0027331872423552333,0.06305640360870149,5,33,60,23.0,55.0,47.0,,SGD,3.984196873699258e-05,71.0,1478.629638671875,8176.0,COMPLETE
434,1398.98095703125,2026-03-24 01:49:06.640913,2026-03-24 01:49:24.468783,0 days 00:00:17.827870,64,0.004224931437616581,0.08392977019148888,5,19,58,18.0,36.0,42.0,,SGD,2.7428251694657496e-05,226.0,1398.98095703125,5020.0,COMPLETE
435,1585.48828125,2026-03-24 01:49:24.488801,2026-03-24 01:49:36.607772,0 days 00:00:12.118971,64,0.008827572522174353,0.05882309411894058,4,22,52,20.0,39.0,,,RMSprop,6.298903039242876e-05,116.0,1585.48828125,3579.0,COMPLETE
436,1414.408935546875,2026-03-24 01:49:36.627288,2026-03-24 01:49:52.966809,0 days 00:00:16.339521,64,0.0060976514034089945,0.04755854844213695,5,25,55,17.0,52.0,37.0,,SGD,4.4501398210013696e-05,197.0,1414.408935546875,5914.0,COMPLETE
437,1437.55419921875,2026-03-24 01:49:52.984992,2026-03-24 01:50:07.486377,0 days 00:00:14.501385,64,0.002414859296063696,0.06082014513633191,5,22,50,21.0,57.0,44.0,,SGD,3.244077095658234e-05,162.0,1437.55419921875,6658.0,COMPLETE
438,1437.8148193359375,2026-03-24 01:50:07.504986,2026-03-24 01:50:17.985011,0 days 00:00:10.480025,64,0.012520532341948451,0.06871808882907568,5,20,57,23.0,27.0,50.0,,SGD,5.110011774967604e-05,112.0,1437.8148193359375,5164.0,COMPLETE
439,1593.2586669921875,2026-03-24 01:50:18.003077,2026-03-24 01:50:29.677641,0 days 00:00:11.674564,64,0.03883019696699485,0.09570937835413197,2,41,61,,,,,SGD,3.605783194050886e-05,185.0,1593.2586669921875,3197.0,COMPLETE
440,1459.251220703125,2026-03-24 01:50:29.698176,2026-03-24 01:50:40.103168,0 days 00:00:10.404992,64,0.004841631520932831,0.052255598392350215,3,24,58,21.0,,,,SGD,4.108480108786768e-05,154.0,1459.251220703125,3133.0,COMPLETE
441,3713.6572265625,2026-03-24 01:50:40.120818,2026-03-24 01:50:42.591242,0 days 00:00:02.470424,64,0.007682932097446498,0.05482263777679141,5,23,54,22.0,14.0,40.0,,Adam,4.517663439944927e-05,,,,PRUNED
442,1376.069091796875,2026-03-24 01:50:42.607078,2026-03-24 01:50:55.227525,0 days 00:00:12.620447,64,0.00164377226309097,0.05711662994329387,5,18,59,19.0,58.0,39.0,,SGD,3.064584825730794e-05,136.0,1376.069091796875,6310.0,COMPLETE
443,1407.3133544921875,2026-03-24 01:50:55.247451,2026-03-24 01:51:15.827354,0 days 00:00:20.579903,64,0.010221780014367306,0.058417051605777696,5,17,31,19.0,57.0,56.0,,SGD,2.4680271048294138e-05,255.0,1407.3133544921875,6124.0,COMPLETE
444,1697.6748046875,2026-03-24 01:51:15.854933,2026-03-24 01:51:25.747488,0 days 00:00:09.892555,32,0.0013039660661447715,0.055274543103993365,5,16,24,21.0,58.0,37.0,,SGD,2.906953118770472e-05,50.0,1697.6748046875,4886.0,COMPLETE
445,1449.350341796875,2026-03-24 01:51:25.766470,2026-03-24 01:51:33.655255,0 days 00:00:07.888785,64,0.003562484712431734,0.05751062793851097,4,18,43,20.0,59.0,,,SGD,3.101061696177929e-05,83.0,1449.350341796875,3438.0,COMPLETE
446,1329.126953125,2026-03-24 01:51:33.672953,2026-03-24 01:51:53.555369,0 days 00:00:19.882416,64,0.006148173349319196,0.056581115506406,5,19,52,26.0,60.0,38.0,,SGD,2.6559984433158988e-05,244.0,1329.126953125,6956.0,COMPLETE
447,1450.4622802734375,2026-03-24 01:51:53.576446,2026-03-24 01:52:03.743154,0 days 00:00:10.166708,64,0.007617299508439947,0.05679517258094686,5,18,49,26.0,58.0,35.0,,SGD,2.5300304639545593e-05,100.0,1450.4622802734375,6432.0,COMPLETE
448,1451.9027099609375,2026-03-24 01:52:03.767067,2026-03-24 01:52:14.386166,0 days 00:00:10.619099,64,0.005790387164625472,0.05880513695620457,5,19,51,27.0,59.0,37.0,,SGD,2.21974266436754e-05,106.0,1451.9027099609375,6891.0,COMPLETE
449,2593.7763671875,2026-03-24 01:52:14.405074,2026-03-24 01:52:16.511574,0 days 00:00:02.106500,64,0.0034154751741446976,0.05606497517464792,5,20,51,19.0,58.0,39.0,,SGD,2.7014219915107398e-05,,,,PRUNED
450,1415.1746826171875,2026-03-24 01:52:16.528452,2026-03-24 01:52:28.162953,0 days 00:00:11.634501,64,0.04884294323972317,0.053782643109659876,4,15,48,30.0,60.0,,,SGD,2.306914003843086e-05,151.0,1415.1746826171875,4600.0,COMPLETE
451,1445.7225341796875,2026-03-24 01:52:28.179130,2026-03-24 01:52:41.751397,0 days 00:00:13.572267,64,0.009480681391114488,0.08182901126895632,5,18,52,28.0,59.0,38.0,,SGD,2.7723784997631743e-05,149.0,1445.7225341796875,7054.0,COMPLETE
452,1543.03369140625,2026-03-24 01:52:41.894913,2026-03-24 01:52:50.864162,0 days 00:00:08.969249,64,0.0011343990645087385,0.056906472143955875,6,19,50,18.0,56.0,34.0,54.0,SGD,6.606837496956442e-05,75.0,1543.03369140625,7498.0,COMPLETE
453,2171.060791015625,2026-03-24 01:52:50.881796,2026-03-24 01:52:54.859513,0 days 00:00:03.977717,16,0.00672235249006992,0.05337504744396916,3,20,52,26.0,,,,SGD,2.024180725225581e-05,,,,PRUNED
454,1433.249755859375,2026-03-24 01:52:54.874530,2026-03-24 01:53:04.420304,0 days 00:00:09.545774,64,0.004595874191307596,0.05787759793051826,5,21,37,22.0,40.0,39.0,,SGD,2.90719816736188e-05,101.0,1433.249755859375,4716.0,COMPLETE
455,1465.5379638671875,2026-03-24 01:53:04.436522,2026-03-24 01:53:16.177718,0 days 00:00:11.741196,64,0.002818434185304472,0.0549244750302627,5,18,47,20.0,44.0,36.0,,SGD,3.1863062651077044e-05,134.0,1465.5379638671875,4926.0,COMPLETE
456,1453.1077880859375,2026-03-24 01:53:16.195674,2026-03-24 01:53:24.049599,0 days 00:00:07.853925,64,0.010933456540998594,0.060595080193774326,4,16,51,24.0,55.0,,,SGD,4.992088239011013e-05,86.0,1453.1077880859375,3982.0,COMPLETE
457,1494.706787109375,2026-03-24 01:53:24.066309,2026-03-24 01:53:36.463556,0 days 00:00:12.397247,64,0.007089119153969606,0.051191241904230696,5,21,52,21.0,34.0,38.0,,RMSprop,2.5295609555031387e-05,103.0,1494.706787109375,4895.0,COMPLETE
458,1496.6048583984375,2026-03-24 01:53:36.484260,2026-03-24 01:53:48.893225,0 days 00:00:12.408965,64,0.008796901382344523,0.053202193445726714,5,17,63,20.0,37.0,58.0,,SGD,3.775949106684454e-05,136.0,1496.6048583984375,5997.0,COMPLETE
459,1469.0233154296875,2026-03-24 01:53:48.911017,2026-03-24 01:53:56.476094,0 days 00:00:07.565077,64,0.0001672428435952752,0.0981921393814098,5,20,27,42.0,57.0,40.0,,SGD,3.4401461979826476e-05,61.0,1469.0233154296875,7107.0,COMPLETE
460,1430.5584716796875,2026-03-24 01:53:56.495210,2026-03-24 01:54:08.332465,0 days 00:00:11.837255,64,0.004806195904657822,0.0559075822892098,5,15,59,28.0,43.0,54.0,,SGD,5.325347617863908e-05,125.0,1430.5584716796875,6835.0,COMPLETE
461,1413.4931640625,2026-03-24 01:54:08.349290,2026-03-24 01:54:19.429878,0 days 00:00:11.080588,64,0.00265719902480037,0.09413969529418972,5,19,61,19.0,39.0,39.0,,SGD,3.0726884580178275e-05,121.0,1413.4931640625,5303.0,COMPLETE
462,1453.3341064453125,2026-03-24 01:54:19.447390,2026-03-24 01:54:38.234685,0 days 00:00:18.787295,64,0.005474693592036912,0.052311854332239956,4,36,49,23.0,61.0,,,SGD,4.303632979852249e-05,265.0,1453.3341064453125,5151.0,COMPLETE
463,2412.91845703125,2026-03-24 01:54:38.258521,2026-03-24 01:54:40.667973,0 days 00:00:02.409452,64,0.013055846671014917,0.05866071619975739,5,17,53,25.0,41.0,41.0,,Adam,5.8813695421380957e-05,,,,PRUNED
464,1543.735107421875,2026-03-24 01:54:40.681923,2026-03-24 01:54:51.318962,0 days 00:00:10.637039,64,0.017648530776436147,0.08040093209045232,5,21,59,18.0,35.0,14.0,,SGD,4.721382573406305e-05,117.0,1543.735107421875,4045.0,COMPLETE
465,1601.8670654296875,2026-03-24 01:54:51.336860,2026-03-24 01:54:59.197355,0 days 00:00:07.860495,64,0.007936630878036106,0.04967783704004758,5,19,50,22.0,37.0,36.0,,SGD,0.0003625299861585032,72.0,1601.8670654296875,4877.0,COMPLETE
466,1458.4581298828125,2026-03-24 01:54:59.213739,2026-03-24 01:55:11.019919,0 days 00:00:11.806180,64,0.003924974934017695,0.06154851657123709,5,11,60,21.0,38.0,48.0,,SGD,3.8519913817101736e-05,135.0,1458.4581298828125,5213.0,COMPLETE
467,1522.5272216796875,2026-03-24 01:55:11.042527,2026-03-24 01:55:17.890932,0 days 00:00:06.848405,64,0.0016361096584762188,0.09997325184215544,5,22,53,20.0,29.0,40.0,,SGD,3.3105716836804056e-05,55.0,1522.5272216796875,4675.0,COMPLETE
468,1426.7216796875,2026-03-24 01:55:17.908355,2026-03-24 01:55:31.204929,0 days 00:00:13.296574,64,0.0061154383524434685,0.05466314246149317,4,20,62,25.0,42.0,,,SGD,2.7486322589132843e-05,176.0,1426.7216796875,4490.0,COMPLETE
469,1557.606689453125,2026-03-24 01:55:31.226280,2026-03-24 01:55:42.927814,0 days 00:00:11.701534,32,8.356071343661219e-05,0.048952908359073254,3,18,51,32.0,,,,SGD,4.919108225880682e-05,103.0,1557.606689453125,3030.0,COMPLETE
