number,value,datetime_start,datetime_complete,duration,params_batch_size,params_dropout_rate,params_lr,params_n_layers,params_n_units_l0,params_n_units_l1,params_n_units_l2,params_n_units_l3,params_n_units_l4,params_n_units_l5,params_optimizer,params_weight_decay,user_attrs_best_epoch,user_attrs_best_val_mae,user_attrs_model_params,state
188,3409.782470703125,2026-03-24 01:04:15.207772,2026-03-24 01:04:17.885476,0 days 00:00:02.677704,64,0.001822024785708741,0.04872943026306028,5,25,58,21.0,31.0,37.0,,Adam,2.9374646287004128e-05,,,,PRUNED
189,1470.77734375,2026-03-24 01:04:17.900934,2026-03-24 01:04:26.700071,0 days 00:00:08.799137,64,0.005262604987589347,0.052421999644827556,5,26,58,18.0,33.0,42.0,,SGD,4.004264670006896e-05,70.0,1470.77734375,5314.0,COMPLETE
190,1604.732421875,2026-03-24 01:04:26.716133,2026-03-24 01:04:38.819243,0 days 00:00:12.103110,32,0.009125264659087733,0.048556764604649576,5,23,60,19.0,36.0,39.0,,SGD,3.683835709869105e-05,59.0,1604.732421875,5363.0,COMPLETE
191,1509.9932861328125,2026-03-24 01:04:38.838340,2026-03-24 01:04:50.452815,0 days 00:00:11.614475,64,0.004267014263685918,0.04579989982738242,5,27,57,22.0,28.0,52.0,,SGD,3.8350307395607595e-05,105.0,1509.9932861328125,5692.0,COMPLETE
192,1437.0272216796875,2026-03-24 01:04:50.474860,2026-03-24 01:05:04.720536,0 days 00:00:14.245676,64,0.0018115751145892497,0.051254264022892376,5,24,59,20.0,34.0,43.0,,SGD,3.2400811744284707e-05,148.0,1437.0272216796875,5514.0,COMPLETE
193,1374.217041015625,2026-03-24 01:05:04.740424,2026-03-24 01:05:24.818977,0 days 00:00:20.078553,64,0.003619513351867434,0.048018401650189155,5,26,57,22.0,30.0,38.0,,SGD,4.542300226053532e-05,216.0,1374.217041015625,5302.0,COMPLETE
194,1445.140869140625,2026-03-24 01:05:24.840724,2026-03-24 01:05:37.690170,0 days 00:00:12.849446,64,0.00017869500737998072,0.04901796432309334,5,25,56,21.0,29.0,38.0,,SGD,4.331557545016675e-05,121.0,1445.140869140625,5033.0,COMPLETE
195,2178.553955078125,2026-03-24 01:05:37.722011,2026-03-24 01:05:39.937719,0 days 00:00:02.215708,64,0.08246659075796915,0.05261258718881293,5,27,58,19.0,30.0,36.0,,SGD,3.950675832724458e-05,,,,PRUNED
196,1552.8922119140625,2026-03-24 01:05:39.950184,2026-03-24 01:05:48.627482,0 days 00:00:08.677298,64,0.0065623323149755245,0.04786482034890782,5,23,62,22.0,33.0,41.0,,SGD,4.725899041992201e-05,80.0,1552.8922119140625,5638.0,COMPLETE
197,1382.42578125,2026-03-24 01:05:48.642362,2026-03-24 01:06:00.045173,0 days 00:00:11.402811,64,0.002023048249085747,0.044923538761771305,5,25,60,17.0,23.0,42.0,,SGD,3.538840143359652e-05,123.0,1382.42578125,4621.0,COMPLETE
198,1401.747314453125,2026-03-24 01:06:00.061863,2026-03-24 01:06:15.617516,0 days 00:00:15.555653,64,0.0024020003782453886,0.04658657252852731,5,26,60,21.0,20.0,42.0,,SGD,3.245298736675188e-05,176.0,1401.747314453125,4838.0,COMPLETE
199,1443.5496826171875,2026-03-24 01:06:15.638445,2026-03-24 01:06:29.945673,0 days 00:00:14.307228,64,0.0021740359756300337,0.04507771150971417,5,25,61,16.0,22.0,44.0,,SGD,2.6527814079403405e-05,171.0,1443.5496826171875,4570.0,COMPLETE
200,1432.826416015625,2026-03-24 01:06:29.973745,2026-03-24 01:06:42.092058,0 days 00:00:12.118313,64,0.0027723952229868017,0.045195227801180425,5,28,58,21.0,18.0,43.0,,SGD,3.375348972271679e-05,133.0,1432.826416015625,4766.0,COMPLETE
201,1473.5245361328125,2026-03-24 01:06:42.110104,2026-03-24 01:06:50.225399,0 days 00:00:08.115295,64,0.00016502395138765847,0.053973637874199995,5,26,60,24.0,21.0,42.0,,SGD,3.007883572189446e-05,73.0,1473.5245361328125,5156.0,COMPLETE
202,1378.2650146484375,2026-03-24 01:06:50.242077,2026-03-24 01:07:06.822696,0 days 00:00:16.580619,64,0.004426691176089802,0.046839682604197894,5,26,60,21.0,10.0,52.0,,SGD,3.723260633710474e-05,198.0,1378.2650146484375,4318.0,COMPLETE
203,1447.66650390625,2026-03-24 01:07:06.842026,2026-03-24 01:07:18.785005,0 days 00:00:11.942979,64,0.004129099987273216,0.04268802018410065,5,24,61,21.0,9.0,51.0,,SGD,3.530927077961829e-05,125.0,1447.66650390625,4135.0,COMPLETE
204,1460.9522705078125,2026-03-24 01:07:18.806922,2026-03-24 01:07:34.485117,0 days 00:00:15.678195,64,0.002365293127731878,0.04761727552816921,5,27,57,19.0,16.0,52.0,,SGD,3.593356998834977e-05,189.0,1460.9522705078125,4540.0,COMPLETE
205,1420.9034423828125,2026-03-24 01:07:34.505672,2026-03-24 01:07:50.746634,0 days 00:00:16.240962,64,0.004790730526806124,0.04496722403878129,5,25,63,22.0,25.0,53.0,,SGD,3.228430291982622e-05,178.0,1420.9034423828125,5654.0,COMPLETE
206,2262.82568359375,2026-03-24 01:07:50.771041,2026-03-24 01:07:57.740973,0 days 00:00:06.969932,16,0.0018198250432852805,0.05018448179458945,5,23,60,20.0,14.0,19.0,,SGD,3.833153303547247e-05,,,,PRUNED
207,1433.1092529296875,2026-03-24 01:07:57.755745,2026-03-24 01:08:12.875231,0 days 00:00:15.119486,64,0.004163155564639238,0.04726689380414578,5,28,58,17.0,31.0,50.0,,SGD,4.0863269207523595e-05,178.0,1433.1092529296875,5514.0,COMPLETE
208,1464.517333984375,2026-03-24 01:08:12.892758,2026-03-24 01:08:24.239621,0 days 00:00:11.346863,64,0.008215314161926592,0.0406647146819726,5,26,56,20.0,32.0,54.0,,SGD,3.647786818827148e-05,104.0,1464.517333984375,5771.0,COMPLETE
209,1367.1033935546875,2026-03-24 01:08:24.255240,2026-03-24 01:08:43.083592,0 days 00:00:18.828352,64,0.003199176922546298,0.05040788758352912,5,24,64,22.0,24.0,55.0,,SGD,2.897426147733512e-05,238.0,1367.1033935546875,5607.0,COMPLETE
210,1521.5848388671875,2026-03-24 01:08:43.101553,2026-03-24 01:08:51.057749,0 days 00:00:07.956196,64,0.005361866774888088,0.043250292967740286,5,29,62,23.0,20.0,54.0,,SGD,2.7470063878651012e-05,61.0,1521.5848388671875,5615.0,COMPLETE
211,1455.4757080078125,2026-03-24 01:08:51.073754,2026-03-24 01:09:02.344981,0 days 00:00:11.271227,64,8.275045755825949e-05,0.050991418855562354,5,25,60,22.0,25.0,57.0,,SGD,3.4445242585753e-05,123.0,1455.4757080078125,5620.0,COMPLETE
212,1426.6644287109375,2026-03-24 01:09:02.363195,2026-03-24 01:09:17.121514,0 days 00:00:14.758319,64,0.0030697818514267795,0.04957352421943707,5,24,64,21.0,22.0,48.0,,SGD,3.14783103085008e-05,173.0,1426.6644287109375,5176.0,COMPLETE
213,1507.2100830078125,2026-03-24 01:09:17.140663,2026-03-24 01:09:32.484983,0 days 00:00:15.344320,64,0.0018243783655548852,0.04673316186944474,5,23,59,20.0,28.0,44.0,,SGD,2.3692879750628987e-05,175.0,1507.2100830078125,5080.0,COMPLETE
214,1616.01611328125,2026-03-24 01:09:32.507130,2026-03-24 01:09:38.785659,0 days 00:00:06.278529,64,0.004285534058129452,0.053417388474455346,5,20,64,22.0,27.0,42.0,,SGD,2.867169041742019e-05,45.0,1616.01611328125,5144.0,COMPLETE
215,1575.9412841796875,2026-03-24 01:09:38.800842,2026-03-24 01:09:44.471516,0 days 00:00:05.670674,64,0.003101021695710743,0.049131607832546775,5,22,57,24.0,23.0,52.0,,SGD,4.0949525699991355e-05,36.0,1575.9412841796875,5133.0,COMPLETE
216,1433.048583984375,2026-03-24 01:09:44.489219,2026-03-24 01:09:56.549101,0 days 00:00:12.059882,64,0.005855035558975714,0.050743033193944374,5,27,27,19.0,24.0,51.0,,SGD,4.5049837998129346e-05,134.0,1433.048583984375,3634.0,COMPLETE
217,1541.3922119140625,2026-03-24 01:09:56.567206,2026-03-24 01:10:04.082513,0 days 00:00:07.515307,64,7.492961009670845e-05,0.05490596208857143,5,25,55,23.0,35.0,56.0,,SGD,3.868316329722085e-05,70.0,1541.3922119140625,6244.0,COMPLETE
218,1475.167236328125,2026-03-24 01:10:04.097627,2026-03-24 01:10:14.861063,0 days 00:00:10.763436,64,0.00914538000463847,0.04558141998236987,5,21,16,21.0,15.0,55.0,,SGD,3.198595525761903e-05,123.0,1475.167236328125,2420.0,COMPLETE
219,1498.7081298828125,2026-03-24 01:10:14.880360,2026-03-24 01:10:22.634274,0 days 00:00:07.753914,64,0.0017564188559883007,0.048645142025985535,5,26,59,22.0,33.0,46.0,,SGD,4.3488615435593934e-05,73.0,1498.7081298828125,5889.0,COMPLETE
220,1505.9517822265625,2026-03-24 01:10:22.651145,2026-03-24 01:10:30.870950,0 days 00:00:08.219805,64,0.00716780340326533,0.04691991728913512,5,40,62,20.0,13.0,49.0,,SGD,3.7041967420291174e-05,68.0,1505.9517822265625,5539.0,COMPLETE
221,1377.6505126953125,2026-03-24 01:10:30.889361,2026-03-24 01:10:48.375841,0 days 00:00:17.486480,64,0.004800787479866029,0.05506874706740172,5,24,59,24.0,38.0,41.0,,SGD,4.874709282772152e-05,229.0,1377.6505126953125,6094.0,COMPLETE
222,1454.2882080078125,2026-03-24 01:10:48.395208,2026-03-24 01:10:57.210770,0 days 00:00:08.815562,64,0.0034622969231487425,0.052764432737114474,5,24,60,23.0,36.0,41.0,,SGD,4.8477747824870784e-05,90.0,1454.2882080078125,5910.0,COMPLETE
223,1626.2244873046875,2026-03-24 01:10:57.226847,2026-03-24 01:11:04.174703,0 days 00:00:06.947856,64,0.004475437278256017,0.05524969657305718,5,23,37,24.0,10.0,43.0,,SGD,4.0662850010838854e-05,53.0,1626.2244873046875,3048.0,COMPLETE
224,1588.6585693359375,2026-03-24 01:11:04.189309,2026-03-24 01:11:10.796150,0 days 00:00:06.606841,64,0.005538245126178136,0.051328747438771805,5,25,58,21.0,38.0,40.0,,SGD,5.5664741447291294e-05,55.0,1588.6585693359375,5773.0,COMPLETE
225,1512.844482421875,2026-03-24 01:11:10.815568,2026-03-24 01:11:19.805477,0 days 00:00:08.989909,64,0.001993106759738312,0.05373297767818236,5,22,57,24.0,19.0,45.0,,SGD,4.4705117781150365e-05,93.0,1512.844482421875,4656.0,COMPLETE
226,1519.1322021484375,2026-03-24 01:11:19.825111,2026-03-24 01:11:28.134044,0 days 00:00:08.308933,64,0.007849352006013317,0.088776955785923,5,27,56,18.0,64.0,41.0,,Adam,6.175668071489948e-05,53.0,1519.1322021484375,7172.0,COMPLETE
227,1378.7974853515625,2026-03-24 01:11:28.149134,2026-03-24 01:11:43.915769,0 days 00:00:15.766635,64,0.004082714463515002,0.051270349731938177,5,18,61,22.0,37.0,39.0,,SGD,3.4806594972811916e-05,193.0,1378.7974853515625,5412.0,COMPLETE
228,1644.3919677734375,2026-03-24 01:11:43.935194,2026-03-24 01:11:48.927940,0 days 00:00:04.992746,64,0.005635286551245521,0.05056425971552587,5,18,62,23.0,37.0,38.0,,SGD,2.9639288374205332e-05,29.0,1644.3919677734375,5516.0,COMPLETE
229,1472.7099609375,2026-03-24 01:11:48.942817,2026-03-24 01:11:59.064755,0 days 00:00:10.121938,64,0.03422883411223168,0.05681632830384913,5,47,61,22.0,39.0,35.0,,SGD,2.570426494366537e-05,103.0,1472.7099609375,7456.0,COMPLETE
230,1559.4554443359375,2026-03-24 01:11:59.084320,2026-03-24 01:12:14.731419,0 days 00:00:15.647099,32,0.009985428395085809,0.05538649949704506,5,16,60,19.0,40.0,47.0,,SGD,6.937506694281775e-05,101.0,1559.4554443359375,5462.0,COMPLETE
231,1476.643310546875,2026-03-24 01:12:14.748568,2026-03-24 01:12:25.655697,0 days 00:00:10.907129,64,0.0034444863328227503,0.04832114022308518,5,18,25,21.0,36.0,39.0,,SGD,3.68711380663652e-05,123.0,1476.643310546875,3736.0,COMPLETE
232,1613.5751953125,2026-03-24 01:12:25.679338,2026-03-24 01:12:32.973768,0 days 00:00:07.294430,64,0.001817676877654525,0.0515224303845659,5,19,59,20.0,34.0,40.0,,SGD,3.414948851569631e-05,65.0,1613.5751953125,5050.0,COMPLETE
233,1447.8477783203125,2026-03-24 01:12:32.992201,2026-03-24 01:12:42.478078,0 days 00:00:09.485877,64,0.004317007654300656,0.052406907586351345,5,24,61,22.0,37.0,43.0,,SGD,4.0491853241188684e-05,96.0,1447.8477783203125,6008.0,COMPLETE
234,1400.8974609375,2026-03-24 01:12:42.494687,2026-03-24 01:12:57.431530,0 days 00:00:14.936843,64,0.0062590284568574284,0.04887713418825048,5,24,58,21.0,41.0,37.0,,SGD,4.624990123403173e-05,183.0,1400.8974609375,5761.0,COMPLETE
235,1451.2470703125,2026-03-24 01:12:57.451748,2026-03-24 01:13:06.483803,0 days 00:00:09.032055,64,0.0069814625225789115,0.0871341400683895,5,21,63,23.0,41.0,37.0,,SGD,4.932735708244394e-05,91.0,1451.2470703125,5993.0,COMPLETE
236,1580.0467529296875,2026-03-24 01:13:06.500464,2026-03-24 01:13:13.160389,0 days 00:00:06.659925,64,0.006334565079130261,0.050348346158625934,5,26,59,24.0,39.0,38.0,,SGD,4.4297931480251255e-05,55.0,1580.0467529296875,6173.0,COMPLETE
237,1415.648681640625,2026-03-24 01:13:13.177212,2026-03-24 01:13:26.380139,0 days 00:00:13.202927,64,0.004953487796196899,0.05440886265217617,5,22,52,19.0,39.0,49.0,,SGD,5.286508894009364e-05,145.0,1415.648681640625,5553.0,COMPLETE
238,1525.4732666015625,2026-03-24 01:13:26.401382,2026-03-24 01:13:34.680830,0 days 00:00:08.279448,64,0.003330399973821668,0.04400796133573142,5,28,60,37.0,41.0,36.0,,SGD,4.6560985043521463e-05,75.0,1525.4732666015625,7760.0,COMPLETE
239,1391.6768798828125,2026-03-24 01:13:34.699078,2026-03-24 01:13:46.445937,0 days 00:00:11.746859,64,0.00908052693278087,0.0585798371936776,5,25,57,25.0,63.0,44.0,,SGD,4.1894411378297796e-05,130.0,1391.6768798828125,8084.0,COMPLETE
240,1528.52880859375,2026-03-24 01:13:46.465111,2026-03-24 01:13:54.157139,0 days 00:00:07.692028,64,0.012172620864552704,0.04633578989404323,5,25,34,26.0,61.0,44.0,,SGD,3.3602672419681555e-05,66.0,1528.52880859375,6819.0,COMPLETE
241,1536.4034423828125,2026-03-24 01:13:54.173381,2026-03-24 01:14:01.866699,0 days 00:00:07.693318,64,0.010158847343113108,0.05851521317635691,5,23,57,22.0,64.0,42.0,,SGD,4.206184544473317e-05,67.0,1536.4034423828125,7512.0,COMPLETE
242,3892.51025390625,2026-03-24 01:14:01.883653,2026-03-24 01:14:04.015414,0 days 00:00:02.131761,64,0.008504922823841075,0.01564398748412322,5,26,53,25.0,62.0,46.0,,SGD,3.954839383199958e-05,,,,PRUNED
243,1477.6959228515625,2026-03-24 01:14:04.028852,2026-03-24 01:14:16.055252,0 days 00:00:12.026400,64,0.007296082217653751,0.05273816329833983,5,24,58,21.0,38.0,53.0,,SGD,4.6411615496643975e-05,122.0,1477.6959228515625,6250.0,COMPLETE
244,1380.9210205078125,2026-03-24 01:14:16.073330,2026-03-24 01:14:32.675685,0 days 00:00:16.602355,64,0.0056881050013815795,0.06946867117112612,5,25,56,24.0,63.0,44.0,,SGD,0.00014191482282556247,200.0,1380.9210205078125,7909.0,COMPLETE
245,1457.442138671875,2026-03-24 01:14:32.695307,2026-03-24 01:14:42.706940,0 days 00:00:10.011633,64,0.005687500968968028,0.07001771762344935,5,25,56,24.0,63.0,45.0,,SGD,0.00010498396264151065,102.0,1457.442138671875,7976.0,COMPLETE
246,1449.54736328125,2026-03-24 01:14:42.725151,2026-03-24 01:14:56.311672,0 days 00:00:13.586521,64,0.008910991819086767,0.07204139773156,5,27,59,23.0,37.0,45.0,,SGD,0.00023514315942658675,157.0,1449.54736328125,6301.0,COMPLETE
247,2389.916748046875,2026-03-24 01:14:56.334375,2026-03-24 01:15:03.344945,0 days 00:00:07.010570,16,0.006679724001733773,0.09054325859522684,5,26,57,26.0,31.0,42.0,,SGD,5.256877070977342e-05,,,,PRUNED
248,1464.1107177734375,2026-03-24 01:15:03.362862,2026-03-24 01:15:15.544104,0 days 00:00:12.181242,64,0.004459170492291984,0.06618628758502862,5,28,58,25.0,42.0,43.0,,SGD,6.093413184931694e-05,143.0,1464.1107177734375,6786.0,COMPLETE
249,1448.9283447265625,2026-03-24 01:15:15.560054,2026-03-24 01:15:24.126378,0 days 00:00:08.566324,64,0.012989951323608848,0.07397035933194177,5,25,42,27.0,61.0,44.0,,SGD,3.5853289756968836e-05,74.0,1448.9283447265625,7357.0,COMPLETE
250,1929.065673828125,2026-03-24 01:15:24.149129,2026-03-24 01:15:29.024400,0 days 00:00:04.875271,64,0.03641650068099488,0.06824634685511131,2,30,61,,,,,SGD,4.936950639807016e-05,,,,PRUNED
251,1516.8936767578125,2026-03-24 01:15:29.039068,2026-03-24 01:15:36.561798,0 days 00:00:07.522730,64,0.0028915918119187317,0.04940267421072454,5,23,60,23.0,40.0,39.0,,SGD,0.0001369132373702269,70.0,1516.8936767578125,6019.0,COMPLETE
252,1474.10595703125,2026-03-24 01:15:36.578382,2026-03-24 01:15:46.745728,0 days 00:00:10.167346,64,0.009865474132796922,0.07765582774198246,5,26,58,22.0,63.0,55.0,,SGD,3.996289354562051e-05,102.0,1474.10595703125,8571.0,COMPLETE
253,1461.6614990234375,2026-03-24 01:15:46.761856,2026-03-24 01:15:57.489017,0 days 00:00:10.727161,64,0.008108596732060217,0.05575578322230804,5,24,55,24.0,23.0,40.0,,RMSprop,0.00014484414338714348,76.0,1461.6614990234375,4843.0,COMPLETE
254,1462.7342529296875,2026-03-24 01:15:57.509616,2026-03-24 01:16:09.118745,0 days 00:00:11.609129,64,0.01135070742441623,0.04776871391269442,5,27,63,21.0,8.0,60.0,,SGD,5.6394281239684145e-05,134.0,1462.7342529296875,4486.0,COMPLETE
255,1529.1717529296875,2026-03-24 01:16:09.140479,2026-03-24 01:16:17.369715,0 days 00:00:08.229236,64,0.04504382513368932,0.05297923534003197,5,29,51,23.0,26.0,38.0,,SGD,3.106147665105141e-05,77.0,1529.1717529296875,5010.0,COMPLETE
256,1398.2603759765625,2026-03-24 01:16:17.387978,2026-03-24 01:16:33.925214,0 days 00:00:16.537236,64,0.005229801177298888,0.05029846172217264,5,23,53,50.0,64.0,47.0,,SGD,0.00015047570166940244,192.0,1398.2603759765625,11020.0,COMPLETE
257,1384.087646484375,2026-03-24 01:16:33.947220,2026-03-24 01:16:47.709894,0 days 00:00:13.762674,64,0.005866597364661499,0.09877038093722651,5,23,53,51.0,64.0,47.0,,SGD,0.0001601175235831273,144.0,1384.087646484375,11140.0,COMPLETE
258,1442.673583984375,2026-03-24 01:16:47.727265,2026-03-24 01:17:04.825221,0 days 00:00:17.097956,64,0.06426437822484783,0.09968853172903067,5,23,53,49.0,64.0,47.0,,Adam,0.00013836825281956323,144.0,1442.673583984375,10900.0,COMPLETE
259,1463.281005859375,2026-03-24 01:17:04.848080,2026-03-24 01:17:11.672667,0 days 00:00:06.824587,64,0.005765690402698245,0.09689394767448081,5,22,55,48.0,64.0,48.0,,SGD,0.00015358142789731704,53.0,1463.281005859375,10930.0,COMPLETE
260,1535.5667724609375,2026-03-24 01:17:11.692563,2026-03-24 01:17:18.507756,0 days 00:00:06.815193,64,0.004962982512003594,0.09748729410603903,5,24,56,52.0,63.0,46.0,,SGD,0.00015635647074410173,44.0,1535.5667724609375,11392.0,COMPLETE
261,1507.20361328125,2026-03-24 01:17:18.524676,2026-03-24 01:17:28.219507,0 days 00:00:09.694831,64,0.007050195551284344,0.09249059443611678,5,23,53,52.0,35.0,45.0,,SGD,0.00019286081757367434,95.0,1507.20361328125,8224.0,COMPLETE
262,1632.271484375,2026-03-24 01:17:28.234500,2026-03-24 01:17:37.474971,0 days 00:00:09.240471,32,0.004423010320406835,0.099447636679596,5,20,56,44.0,62.0,48.0,,SGD,0.00018813353346799224,41.0,1632.271484375,10187.0,COMPLETE
263,1423.9287109375,2026-03-24 01:17:37.491408,2026-03-24 01:17:47.843738,0 days 00:00:10.352330,64,0.006605023937233705,0.09484767250066266,5,24,52,17.0,64.0,47.0,,SGD,0.00012020801310451512,96.0,1423.9287109375,7080.0,COMPLETE
264,1452.88232421875,2026-03-24 01:17:47.864346,2026-03-24 01:17:59.052097,0 days 00:00:11.187751,64,0.00303129202146735,0.05127759831854378,5,22,55,53.0,44.0,44.0,,SGD,0.00013168693077944034,116.0,1452.88232421875,9268.0,COMPLETE
265,1435.281005859375,2026-03-24 01:17:59.075123,2026-03-24 01:18:12.613666,0 days 00:00:13.538543,64,0.008531587578323958,0.05401519686886243,5,25,57,50.0,38.0,35.0,,SGD,0.00016530416658262024,153.0,1435.281005859375,8356.0,COMPLETE
266,1401.0867919921875,2026-03-24 01:18:12.630864,2026-03-24 01:18:26.020603,0 days 00:00:13.389739,64,0.0015980502457440902,0.05003090111875452,5,25,51,55.0,29.0,50.0,,SGD,0.00018016334370862268,144.0,1401.0867919921875,8006.0,COMPLETE
267,1551.2969970703125,2026-03-24 01:18:26.038074,2026-03-24 01:18:32.862082,0 days 00:00:06.824008,64,0.005099417698393501,0.09869091975780261,5,16,54,51.0,34.0,37.0,,SGD,0.00021055565516641018,55.0,1551.2969970703125,7352.0,COMPLETE
268,1399.173095703125,2026-03-24 01:18:32.877517,2026-03-24 01:18:53.802912,0 days 00:00:20.925395,64,0.0039536987169265965,0.057137138745251406,5,24,59,20.0,37.0,46.0,,SGD,0.00016990800640624096,275.0,1399.173095703125,5835.0,COMPLETE
269,1880.896484375,2026-03-24 01:18:53.824936,2026-03-24 01:19:06.265973,0 days 00:00:12.441037,16,0.003372671099332071,0.05742339399019763,5,17,59,34.0,37.0,47.0,,SGD,0.00015396905513770677,22.0,1880.896484375,6772.0,COMPLETE
270,1453.949951171875,2026-03-24 01:19:06.283138,2026-03-24 01:19:19.691251,0 days 00:00:13.408113,64,0.0015840851822620005,0.05589847413957401,5,20,19,18.0,36.0,46.0,,SGD,0.00017362517849701717,162.0,1453.949951171875,3650.0,COMPLETE
271,1320.748291015625,2026-03-24 01:19:19.709740,2026-03-24 01:19:38.507993,0 days 00:00:18.798253,64,0.003997242561571155,0.06350257039990975,5,23,53,19.0,39.0,45.0,,SGD,0.00020444543410918936,240.0,1320.748291015625,5489.0,COMPLETE
272,1486.40283203125,2026-03-24 01:19:38.547104,2026-03-24 01:19:49.324673,0 days 00:00:10.777569,64,0.004951718160734254,0.05900122442970291,5,22,62,60.0,39.0,44.0,,SGD,0.00016768379448921328,103.0,1486.40283203125,10042.0,COMPLETE
273,1402.8687744140625,2026-03-24 01:19:49.344269,2026-03-24 01:20:01.688056,0 days 00:00:12.343787,64,0.007966174584140583,0.05745554344175918,5,23,53,19.0,37.0,51.0,,SGD,0.0002014123160401773,140.0,1402.8687744140625,5601.0,COMPLETE
274,1644.8690185546875,2026-03-24 01:20:01.705684,2026-03-24 01:20:08.466408,0 days 00:00:06.760724,64,0.002035251442356634,0.06591735998432244,5,21,55,17.0,38.0,41.0,,SGD,0.00028342188600750137,56.0,1644.8690185546875,5020.0,COMPLETE
275,1468.6080322265625,2026-03-24 01:20:08.481825,2026-03-24 01:20:22.083166,0 days 00:00:13.601341,64,0.005198521905472155,0.06043093183991849,5,19,29,20.0,36.0,43.0,,RMSprop,0.00022476979860346826,112.0,1468.6080322265625,4036.0,COMPLETE
276,1556.468505859375,2026-03-24 01:20:22.103182,2026-03-24 01:20:30.833666,0 days 00:00:08.730484,64,0.003946428443594988,0.06330376782547595,5,24,61,18.0,40.0,45.0,,SGD,0.00017931790039570303,85.0,1556.468505859375,5884.0,COMPLETE
277,1403.52392578125,2026-03-24 01:20:30.852117,2026-03-24 01:20:42.140835,0 days 00:00:11.288718,64,0.007175084577290595,0.08848497796542236,5,22,57,16.0,35.0,43.0,,SGD,0.00014829698754967817,131.0,1403.52392578125,4970.0,COMPLETE
278,1518.61962890625,2026-03-24 01:20:42.165573,2026-03-24 01:20:52.388842,0 days 00:00:10.223269,64,0.0014463806302990301,0.06254800076409556,5,23,23,19.0,30.0,49.0,,SGD,0.00012698880501464853,109.0,1518.61962890625,3672.0,COMPLETE
279,1537.6929931640625,2026-03-24 01:20:52.408329,2026-03-24 01:20:59.883699,0 days 00:00:07.475370,64,0.003428377016697963,0.056081503604287,4,25,59,20.0,39.0,,,SGD,0.00020328525355543326,79.0,1537.6929931640625,4104.0,COMPLETE
280,1496.41064453125,2026-03-24 01:20:59.900014,2026-03-24 01:21:13.739501,0 days 00:00:13.839487,64,0.00018812694112506172,0.09627670740993555,5,21,50,20.0,48.0,45.0,,Adam,0.0001683699648680358,116.0,1496.41064453125,5936.0,COMPLETE
