number,value,datetime_start,datetime_complete,duration,params_batch_size,params_dropout_rate,params_lr,params_n_layers,params_n_units_l0,params_n_units_l1,params_n_units_l2,params_n_units_l3,params_n_units_l4,params_n_units_l5,params_optimizer,params_weight_decay,user_attrs_best_epoch,user_attrs_best_val_mae,user_attrs_model_params,state
470,1395.685791015625,2026-03-24 01:55:42.953745,2026-03-24 01:55:53.854131,0 days 00:00:10.900386,64,0.00990029977036369,0.05223986472491718,5,12,54,29.0,35.0,38.0,,SGD,4.168097749304633e-05,118.0,1395.685791015625,5198.0,COMPLETE
471,1446.5084228515625,2026-03-24 01:55:53.873142,2026-03-24 01:56:02.935509,0 days 00:00:09.062367,64,0.0036435104652378365,0.05668325157831787,5,43,59,22.0,60.0,42.0,,SGD,3.6291642291751274e-05,79.0,1446.5084228515625,8740.0,COMPLETE
472,1383.0068359375,2026-03-24 01:56:02.958465,2026-03-24 01:56:18.729334,0 days 00:00:15.770869,64,0.006556774521090113,0.08550220120535662,5,16,52,19.0,31.0,32.0,,SGD,6.983591876581913e-05,187.0,1383.0068359375,4012.0,COMPLETE
473,1478.360107421875,2026-03-24 01:56:18.751670,2026-03-24 01:56:30.534808,0 days 00:00:11.783138,64,0.008332705617130476,0.05081494931450725,5,22,58,24.0,40.0,41.0,,SGD,5.767346125861872e-05,127.0,1478.360107421875,6041.0,COMPLETE
474,2104.39404296875,2026-03-24 01:56:30.553788,2026-03-24 01:56:36.007935,0 days 00:00:05.454147,16,0.005097570697593789,0.09764023099109105,5,38,64,17.0,33.0,51.0,,SGD,4.512437776523896e-05,,,,PRUNED
475,1432.052001953125,2026-03-24 01:56:36.022831,2026-03-24 01:56:45.096239,0 days 00:00:09.073408,64,0.00217753008372825,0.05407262854233055,5,31,61,20.0,38.0,46.0,,SGD,2.9950439164145126e-05,92.0,1432.052001953125,6502.0,COMPLETE
476,1428.33935546875,2026-03-24 01:56:45.112970,2026-03-24 01:56:55.741179,0 days 00:00:10.628209,64,0.003869233345407853,0.09493163882394877,4,19,54,27.0,58.0,,,SGD,4.162800083111783e-05,132.0,1428.33935546875,4735.0,COMPLETE
477,1395.9256591796875,2026-03-24 01:56:55.757953,2026-03-24 01:57:15.034128,0 days 00:00:19.276175,64,0.006716140478338411,0.04806202217144022,5,33,33,21.0,36.0,37.0,,SGD,5.21280323725377e-05,244.0,1395.9256591796875,4652.0,COMPLETE
478,1537.6993408203125,2026-03-24 01:57:15.183317,2026-03-24 01:57:21.505244,0 days 00:00:06.321927,64,0.010356949670072689,0.06059048319140601,3,13,57,23.0,,,,SGD,3.3739350780712925e-05,70.0,1537.6993408203125,2459.0,COMPLETE
479,2372.144775390625,2026-03-24 01:57:21.523899,2026-03-24 01:57:23.841797,0 days 00:00:02.317898,64,0.0017756424880786194,0.05674971323241117,5,17,22,18.0,8.0,39.0,,RMSprop,3.800586444738237e-05,,,,PRUNED
480,1488.1099853515625,2026-03-24 01:57:23.857850,2026-03-24 01:57:33.710530,0 days 00:00:09.852680,64,0.005040769588164313,0.05048343054275313,4,21,52,26.0,54.0,,,SGD,4.739651811498065e-05,118.0,1488.1099853515625,4530.0,COMPLETE
481,4804.71826171875,2026-03-24 01:57:33.734196,2026-03-24 01:57:35.977533,0 days 00:00:02.243337,64,0.03281619820435524,0.012628921406856772,5,14,50,19.0,56.0,34.0,,SGD,4.0312035700240984e-05,,,,PRUNED
482,1491.0157470703125,2026-03-24 01:57:35.992412,2026-03-24 01:57:46.114363,0 days 00:00:10.121951,64,0.008223188773425205,0.054957897261528804,5,23,60,23.0,34.0,53.0,,SGD,3.507635551646195e-05,101.0,1491.0157470703125,6161.0,COMPLETE
483,1379.983642578125,2026-03-24 01:57:46.133782,2026-03-24 01:58:05.093146,0 days 00:00:18.959364,64,0.003066562267057312,0.058583300521929525,5,20,53,22.0,46.0,20.0,,SGD,6.229339087076568e-05,243.0,1379.983642578125,4822.0,COMPLETE
484,1400.5050048828125,2026-03-24 01:58:05.116437,2026-03-24 01:58:16.560153,0 days 00:00:11.443716,64,0.0028243333096866436,0.06163524570447915,5,20,55,24.0,46.0,24.0,,SGD,6.358538364475829e-05,130.0,1400.5050048828125,5320.0,COMPLETE
485,1453.2237548828125,2026-03-24 01:58:16.577689,2026-03-24 01:58:25.944752,0 days 00:00:09.367063,64,0.0011782447088971378,0.059936251560321264,5,21,58,22.0,49.0,21.0,,SGD,0.0005234179670107838,95.0,1453.2237548828125,5304.0,COMPLETE
486,1509.971923828125,2026-03-24 01:58:25.965220,2026-03-24 01:58:40.989515,0 days 00:00:15.024295,64,0.05182148133076325,0.05817895125383805,5,20,53,24.0,45.0,37.0,,SGD,1.033113781857281e-05,183.0,1509.971923828125,5812.0,COMPLETE
487,1351.8297119140625,2026-03-24 01:58:41.011510,2026-03-24 01:58:59.228485,0 days 00:00:18.216975,64,0.0036054461528768514,0.0588720708848797,4,18,63,21.0,58.0,,,SGD,6.183222213795274e-05,253.0,1351.8297119140625,4358.0,COMPLETE
488,1572.3443603515625,2026-03-24 01:58:59.252896,2026-03-24 01:59:04.715067,0 days 00:00:05.462171,64,6.438245095556129e-05,0.05651134649107866,4,16,64,21.0,59.0,,,SGD,5.691006744871717e-05,45.0,1572.3443603515625,4275.0,COMPLETE
489,1395.607421875,2026-03-24 01:59:04.732312,2026-03-24 01:59:20.495925,0 days 00:00:15.763613,64,0.005198672951842867,0.06401658953465808,4,18,64,15.0,57.0,,,Adam,7.232790333910621e-05,173.0,1395.607421875,3631.0,COMPLETE
490,1566.1219482421875,2026-03-24 01:59:20.516596,2026-03-24 01:59:32.008906,0 days 00:00:11.492310,32,0.011847795356963745,0.053855801147838896,4,19,62,20.0,58.0,,,SGD,7.438234167569729e-05,78.0,1566.1219482421875,4266.0,COMPLETE
491,1527.2462158203125,2026-03-24 01:59:32.027474,2026-03-24 01:59:39.510742,0 days 00:00:07.483268,64,0.023061533394403602,0.059599724399928375,4,18,63,23.0,59.0,,,SGD,7.969825005577323e-05,77.0,1527.2462158203125,4633.0,COMPLETE
492,1511.2266845703125,2026-03-24 01:59:39.527848,2026-03-24 01:59:47.542002,0 days 00:00:08.014154,64,0.006771054858836354,0.05251639558935985,4,17,63,26.0,60.0,,,SGD,0.0002794505146869586,83.0,1511.2266845703125,4964.0,COMPLETE
493,1453.6904296875,2026-03-24 01:59:47.562340,2026-03-24 02:00:00.706527,0 days 00:00:13.144187,64,0.0035091487082118283,0.05764140242847235,4,23,62,37.0,55.0,,,SGD,6.675150445260988e-05,158.0,1453.6904296875,6526.0,COMPLETE
494,1463.8055419921875,2026-03-24 02:00:00.725623,2026-03-24 02:00:09.854520,0 days 00:00:09.128897,64,0.004663268973164084,0.09647251927121857,4,45,61,25.0,16.0,,,SGD,2.6078247364060076e-05,103.0,1463.8055419921875,5488.0,COMPLETE
495,1364.71533203125,2026-03-24 02:00:09.872847,2026-03-24 02:00:27.557437,0 days 00:00:17.684590,64,0.014515035346859486,0.06299990889137634,4,18,62,19.0,57.0,,,SGD,3.1475415915297116e-05,247.0,1364.71533203125,4047.0,COMPLETE
496,1537.1304931640625,2026-03-24 02:00:27.576400,2026-03-24 02:00:34.121737,0 days 00:00:06.545337,64,0.01419965320759145,0.06308112380489707,4,41,63,18.0,57.0,,,SGD,3.0217759954300368e-05,55.0,1537.1304931640625,5666.0,COMPLETE
497,1740.126220703125,2026-03-24 02:00:34.143432,2026-03-24 02:00:48.848526,0 days 00:00:14.705094,16,0.0015530843910744954,0.062053700305494605,4,15,62,19.0,56.0,,,SGD,3.2643296719246117e-05,48.0,1740.126220703125,3805.0,COMPLETE
498,1912.387451171875,2026-03-24 02:00:48.865800,2026-03-24 02:00:52.697821,0 days 00:00:03.832021,64,0.014280730591679738,0.06477385502172232,2,22,62,,,,,SGD,2.8640313990650016e-05,,,,PRUNED
499,1518.5029296875,2026-03-24 02:00:52.713128,2026-03-24 02:01:01.806088,0 days 00:00:09.092960,64,0.01703128296352775,0.06034345877284277,4,17,64,16.0,57.0,,,SGD,3.1368542000105335e-05,102.0,1518.5029296875,3680.0,COMPLETE
