number,value,datetime_start,datetime_complete,duration,params_batch_size,params_dropout_rate,params_lr,params_n_layers,params_n_units_l0,params_n_units_l1,params_n_units_l2,params_n_units_l3,params_n_units_l4,params_n_units_l5,params_optimizer,params_weight_decay,user_attrs_best_epoch,user_attrs_best_val_mae,user_attrs_model_params,state
0,1571.1617431640625,2026-03-24 00:22:50.047106,2026-03-24 00:23:21.470309,0 days 00:00:31.423203,32,0.014041677639819287,0.0737265320016441,4,16,11,57.0,42.0,,,Adam,1.0994335574766187e-05,212.0,1571.1617431640625,3746.0,COMPLETE
1,1632.0379638671875,2026-03-24 00:23:21.521233,2026-03-24 00:23:31.734843,0 days 00:00:10.213610,64,0.038875051677790415,0.04297256589643226,4,24,42,15.0,24.0,,,Adam,8.168455894760161e-05,96.0,1632.0379638671875,2530.0,COMPLETE
2,1507.1656494140625,2026-03-24 00:23:31.749691,2026-03-24 00:23:40.114139,0 days 00:00:08.364448,64,0.005854643368675156,0.0827557613304815,2,62,63,,,,,SGD,4.066563313514796e-05,120.0,1507.1656494140625,4841.0,COMPLETE
3,1607.1375732421875,2026-03-24 00:23:40.145576,2026-03-24 00:24:04.115576,0 days 00:00:23.970000,32,0.023290198344001523,0.07976195410250031,6,45,25,37.0,39.0,18.0,63.0,RMSprop,0.0007568292060167617,102.0,1607.1375732421875,6434.0,COMPLETE
4,1568.3526611328125,2026-03-24 00:24:04.132821,2026-03-24 00:24:18.724503,0 days 00:00:14.591682,32,0.03498095607205338,0.03528410587186427,3,23,55,28.0,,,,SGD,0.00012172847081122418,137.0,1568.3526611328125,3336.0,COMPLETE
5,1834.096435546875,2026-03-24 00:24:18.741055,2026-03-24 00:24:46.883412,0 days 00:00:28.142357,16,0.07339152856093507,0.07941433120173512,2,48,49,,,,,RMSprop,1.4063366777718176e-05,150.0,1834.096435546875,3077.0,COMPLETE
6,1742.0692138671875,2026-03-24 00:24:46.902570,2026-03-24 00:25:11.037125,0 days 00:00:24.134555,16,0.029266498982407234,0.05249934326457544,3,49,44,58.0,,,,SGD,1.7345566642360933e-05,130.0,1742.0692138671875,5612.0,COMPLETE
7,1979.1336669921875,2026-03-24 00:25:11.052484,2026-03-24 00:25:42.087478,0 days 00:00:31.034994,16,0.002287721406968567,0.055771362204823254,4,14,9,44.0,25.0,,,RMSprop,0.0006533305220227731,118.0,1979.1336669921875,2036.0,COMPLETE
8,1663.5804443359375,2026-03-24 00:25:42.104158,2026-03-24 00:25:58.493706,0 days 00:00:16.389548,64,0.08367278871083157,0.0884314531168946,2,54,44,,,,,SGD,0.00040489662225846743,282.0,1663.5804443359375,3147.0,COMPLETE
9,1853.9254150390625,2026-03-24 00:25:58.514385,2026-03-24 00:26:05.207645,0 days 00:00:06.693260,32,0.020514164628774752,0.08746575249307091,2,32,54,,,,,Adam,1.0325337616482036e-05,33.0,1853.9254150390625,2297.0,COMPLETE
10,1651.806396484375,2026-03-24 00:26:05.223901,2026-03-24 00:26:18.752090,0 days 00:00:13.528189,64,0.06265060230224888,0.01872719017734517,5,62,64,10.0,62.0,62.0,,SGD,5.045088829639178e-05,108.0,1651.806396484375,10411.0,COMPLETE
11,1616.9964599609375,2026-03-24 00:26:18.770896,2026-03-24 00:26:45.556202,0 days 00:00:26.785306,32,0.0482061837631941,0.024049827227484576,3,34,63,29.0,,,,SGD,0.00019001907931489773,208.0,1616.9964599609375,4649.0,COMPLETE
12,1456.084228515625,2026-03-24 00:26:45.584794,2026-03-24 00:26:58.120022,0 days 00:00:12.535228,64,0.006534441042245924,0.09918751073151034,3,25,56,25.0,,,,SGD,4.710918310588886e-05,133.0,1456.084228515625,3344.0,COMPLETE
13,1376.8265380859375,2026-03-24 00:26:58.160052,2026-03-24 00:27:08.566295,0 days 00:00:10.406243,64,0.0004083345290186481,0.09990412097690146,3,40,28,21.0,,,,SGD,3.845325335416456e-05,87.0,1376.8265380859375,2317.0,COMPLETE
14,1539.50732421875,2026-03-24 00:27:08.606797,2026-03-24 00:27:18.454415,0 days 00:00:09.847618,64,0.002537696350514608,0.09503863703666904,3,38,28,21.0,,,,SGD,2.958523910479902e-05,119.0,1539.50732421875,2239.0,COMPLETE
15,1603.7828369140625,2026-03-24 00:27:18.473326,2026-03-24 00:27:33.942890,0 days 00:00:15.469564,64,0.05052443390813716,0.067552161964379,5,26,32,24.0,12.0,8.0,,SGD,2.542651593755518e-05,150.0,1603.7828369140625,2507.0,COMPLETE
16,1449.483642578125,2026-03-24 00:27:33.961740,2026-03-24 00:27:43.230742,0 days 00:00:09.269002,64,0.012095285338073233,0.09876334979943424,3,9,22,42.0,,,,SGD,7.157419832395584e-05,98.0,1449.483642578125,1456.0,COMPLETE
17,1566.253173828125,2026-03-24 00:27:43.248775,2026-03-24 00:27:53.627880,0 days 00:00:10.379105,64,0.014764998237950678,0.06772153064317916,5,10,19,42.0,63.0,51.0,,SGD,0.0002208991532855749,80.0,1566.253173828125,7534.0,COMPLETE
18,1634.1300048828125,2026-03-24 00:27:53.647396,2026-03-24 00:28:00.310368,0 days 00:00:06.662972,64,0.014795706384898688,0.09921494765292399,3,40,20,48.0,,,,Adam,7.862382430781909e-05,45.0,1634.1300048828125,2453.0,COMPLETE
19,1489.399658203125,2026-03-24 00:28:00.330203,2026-03-24 00:28:13.921141,0 days 00:00:13.590938,64,0.02637534535184991,0.05656173086926601,4,31,36,37.0,49.0,,,RMSprop,0.00017673147773316622,87.0,1489.399658203125,5018.0,COMPLETE
20,2296.337890625,2026-03-24 00:28:13.940130,2026-03-24 00:28:21.664900,0 days 00:00:07.724770,16,0.05668688078778236,0.09029159037277926,4,17,18,49.0,8.0,,,SGD,0.00010828701023857698,,,,PRUNED
21,1551.422607421875,2026-03-24 00:28:21.681953,2026-03-24 00:28:30.930541,0 days 00:00:09.248588,64,0.008958650137800806,0.09873430901072315,3,20,26,18.0,,,,SGD,5.5948448355461875e-05,118.0,1551.422607421875,1359.0,COMPLETE
22,1527.25341796875,2026-03-24 00:28:30.950193,2026-03-24 00:28:45.610799,0 days 00:00:14.660606,64,0.010436413033161946,0.09976583935348463,3,8,32,31.0,,,,SGD,3.0050769351471794e-05,140.0,1527.25341796875,1557.0,COMPLETE
23,1469.622314453125,2026-03-24 00:28:45.628166,2026-03-24 00:28:59.820267,0 days 00:00:14.192101,64,0.00012103029032598574,0.09064722037281807,2,28,15,,,,,SGD,5.42143120861154e-05,191.0,1469.622314453125,789.0,COMPLETE
24,1455.47607421875,2026-03-24 00:28:59.842598,2026-03-24 00:29:16.434211,0 days 00:00:16.591613,64,0.018214167219292025,0.07020616878068997,3,42,38,13.0,,,,SGD,2.1593173603445135e-05,186.0,1455.47607421875,2719.0,COMPLETE
25,1508.869873046875,2026-03-24 00:29:16.453328,2026-03-24 00:29:23.022688,0 days 00:00:06.569360,64,0.01932060409009826,0.0698657166483352,3,41,38,8.0,,,,SGD,1.9798469523111206e-05,39.0,1508.869873046875,2460.0,COMPLETE
26,1674.0069580078125,2026-03-24 00:29:23.051087,2026-03-24 00:29:30.398308,0 days 00:00:07.347221,64,0.03734922463759452,0.07391928010613386,2,45,23,,,,,SGD,3.199785134206551e-05,90.0,1674.0069580078125,1623.0,COMPLETE
27,1473.5672607421875,2026-03-24 00:29:30.427376,2026-03-24 00:29:44.130434,0 days 00:00:13.703058,64,0.029164629663049002,0.08360754005884095,4,56,29,13.0,26.0,,,Adam,1.9757802247817576e-05,135.0,1473.5672607421875,3186.0,COMPLETE
28,2148.5009765625,2026-03-24 00:29:44.147691,2026-03-24 00:29:50.788788,0 days 00:00:06.641097,16,0.017705640108919098,0.04513857705357202,3,35,36,18.0,,,,RMSprop,6.985663375431166e-05,,,,PRUNED
29,1559.661376953125,2026-03-24 00:29:50.802356,2026-03-24 00:29:59.116181,0 days 00:00:08.313825,64,0.011854687510760202,0.06309760302880751,4,53,32,32.0,54.0,,,SGD,1.3891492314707989e-05,87.0,1559.661376953125,5440.0,COMPLETE
30,1645.2352294921875,2026-03-24 00:29:59.134156,2026-03-24 00:30:17.704089,0 days 00:00:18.569933,32,0.024388253845637937,0.075079223398139,4,43,13,51.0,17.0,,,Adam,0.00013451675553062878,111.0,1645.2352294921875,2823.0,COMPLETE
31,1420.2889404296875,2026-03-24 00:30:17.721892,2026-03-24 00:30:31.737063,0 days 00:00:14.015171,64,0.009942591327895276,0.09178750709435692,3,15,56,25.0,,,,SGD,4.1213801192061676e-05,221.0,1420.2889404296875,2674.0,COMPLETE
32,1446.540771484375,2026-03-24 00:30:31.754711,2026-03-24 00:30:41.995626,0 days 00:00:10.240915,64,0.010597095278366166,0.09324175927278638,3,13,49,21.0,,,,SGD,3.669619896928427e-05,154.0,1446.540771484375,2041.0,COMPLETE
33,1457.16845703125,2026-03-24 00:30:42.015751,2026-03-24 00:30:58.469709,0 days 00:00:16.453958,64,0.0075271517258891606,0.09390214133212327,2,12,59,,,,,SGD,3.798417822536029e-05,307.0,1457.16845703125,1077.0,COMPLETE
34,1539.0765380859375,2026-03-24 00:30:58.488822,2026-03-24 00:31:04.872943,0 days 00:00:06.384121,64,0.0010659964151632476,0.08441406813277731,3,18,50,23.0,,,,SGD,6.738630278835172e-05,79.0,1539.0765380859375,2491.0,COMPLETE
35,1421.7403564453125,2026-03-24 00:31:04.888683,2026-03-24 00:31:17.514000,0 days 00:00:12.625317,64,0.012244438387696132,0.09474721995937638,6,14,49,19.0,30.0,33.0,9.0,SGD,3.801024520291603e-05,136.0,1421.7403564453125,4058.0,COMPLETE
36,1558.580322265625,2026-03-24 00:31:17.533561,2026-03-24 00:31:27.737878,0 days 00:00:10.204317,64,0.04168818787047682,0.07875362214545578,6,21,49,19.0,34.0,33.0,9.0,SGD,3.959729833012425e-05,102.0,1558.580322265625,4698.0,COMPLETE
37,2538.38671875,2026-03-24 00:31:27.756745,2026-03-24 00:31:32.584164,0 days 00:00:04.827419,32,0.034117877446076195,0.09418726824673586,5,13,51,26.0,34.0,34.0,,RMSprop,3.703116743399964e-05,,,,PRUNED
38,5494.02294921875,2026-03-24 00:31:32.603064,2026-03-24 00:31:35.464930,0 days 00:00:02.861866,64,0.006794647394905038,0.08612712259215631,6,15,59,33.0,48.0,46.0,8.0,Adam,1.4438818966043743e-05,,,,PRUNED
39,1832.4749755859375,2026-03-24 00:31:35.498869,2026-03-24 00:31:55.065065,0 days 00:00:19.566196,16,0.0048307179811780815,0.08093938213461667,5,22,45,16.0,19.0,23.0,,SGD,9.396568477410102e-05,66.0,1832.4749755859375,3026.0,COMPLETE
40,1466.0885009765625,2026-03-24 00:31:55.079950,2026-03-24 00:32:08.278098,0 days 00:00:13.198148,64,0.022411304021050425,0.09317459582068667,6,18,46,63.0,30.0,40.0,33.0,SGD,2.6073708024454542e-05,135.0,1466.0885009765625,9004.0,COMPLETE
41,1555.154052734375,2026-03-24 00:32:08.296584,2026-03-24 00:32:17.019301,0 days 00:00:08.722717,64,0.011097949689617704,0.09530687593184943,3,9,53,21.0,,,,SGD,6.466037518848408e-05,115.0,1555.154052734375,1933.0,COMPLETE
42,1769.087646484375,2026-03-24 00:32:17.036104,2026-03-24 00:32:22.330820,0 days 00:00:05.294716,64,0.014822492249775141,0.09029103672062531,2,12,40,,,,,SGD,5.139161645041605e-05,70.0,1769.087646484375,773.0,COMPLETE
43,1611.564697265625,2026-03-24 00:32:22.347760,2026-03-24 00:32:28.287600,0 days 00:00:05.939840,64,0.030018487327427762,0.08717458839113217,3,11,60,43.0,,,,SGD,9.441048226593907e-05,62.0,1611.564697265625,3714.0,COMPLETE
44,1482.5203857421875,2026-03-24 00:32:28.302584,2026-03-24 00:32:44.653032,0 days 00:00:16.350448,64,0.003979797509014582,0.03780798227499427,4,15,22,28.0,47.0,,,SGD,3.976094919935507e-05,227.0,1482.5203857421875,2766.0,COMPLETE
45,1516.705810546875,2026-03-24 00:32:44.670598,2026-03-24 00:32:55.581496,0 days 00:00:10.910898,32,0.01247346937481408,0.09647913047248682,2,8,47,,,,,SGD,4.4200935214920293e-05,122.0,1516.705810546875,653.0,COMPLETE
46,1605.665771484375,2026-03-24 00:32:55.597748,2026-03-24 00:33:04.870530,0 days 00:00:09.272782,64,0.07464021468586832,0.07836024405620282,4,28,56,37.0,56.0,,,RMSprop,2.478348731993124e-05,73.0,1605.665771484375,6524.0,COMPLETE
47,1885.501708984375,2026-03-24 00:33:04.894432,2026-03-24 00:33:16.480946,0 days 00:00:11.586514,16,0.016332821541786554,0.09153547182851683,3,16,42,14.0,,,,SGD,0.00014267446513099795,37.0,1885.501708984375,1619.0,COMPLETE
48,1463.7904052734375,2026-03-24 00:33:16.495772,2026-03-24 00:33:25.080600,0 days 00:00:08.584828,64,0.0002561594295800141,0.08691866953669668,4,13,53,21.0,17.0,,,SGD,8.2379070611076e-05,101.0,1463.7904052734375,2593.0,COMPLETE
49,1590.9708251953125,2026-03-24 00:33:25.101368,2026-03-24 00:33:31.423297,0 days 00:00:06.321929,64,0.008267149069836513,0.0830911084288798,3,19,29,41.0,,,,SGD,0.00030591704025331994,75.0,1590.9708251953125,2201.0,COMPLETE
50,8351.00390625,2026-03-24 00:33:31.439110,2026-03-24 00:33:33.778625,0 days 00:00:02.339515,32,0.020511205280603184,0.010383908373715306,2,37,61,,,,,Adam,3.309780950720574e-05,,,,PRUNED
51,1626.76318359375,2026-03-24 00:33:33.792309,2026-03-24 00:33:40.706483,0 days 00:00:06.914174,64,0.0049139251015433835,0.09997985838037023,3,46,42,12.0,,,,SGD,0.0009805134027019461,93.0,1626.76318359375,3117.0,COMPLETE
52,1493.06005859375,2026-03-24 00:33:40.724242,2026-03-24 00:33:51.351362,0 days 00:00:10.627120,64,0.017714547989051355,0.09573365141929904,3,39,57,15.0,,,,SGD,2.16858443499289e-05,143.0,1493.06005859375,3739.0,COMPLETE
53,1710.784423828125,2026-03-24 00:33:51.367871,2026-03-24 00:33:56.345399,0 days 00:00:04.977528,64,0.08946881159892,0.05821594293117584,3,48,34,11.0,,,,SGD,1.7368005512636155e-05,45.0,1710.784423828125,2681.0,COMPLETE
54,1463.34423828125,2026-03-24 00:33:56.361374,2026-03-24 00:34:08.983156,0 days 00:00:12.621782,64,0.013059569984754332,0.049660556460057015,3,43,25,16.0,,,,SGD,5.909858731637387e-05,209.0,1463.34423828125,2088.0,COMPLETE
55,1471.3570556640625,2026-03-24 00:34:09.001724,2026-03-24 00:34:24.381192,0 days 00:00:15.379468,64,0.024863593417377438,0.09002452112964414,3,33,48,26.0,,,,SGD,4.605359285896185e-05,234.0,1471.3570556640625,3444.0,COMPLETE
56,1629.0716552734375,2026-03-24 00:34:24.399126,2026-03-24 00:34:30.425936,0 days 00:00:06.026810,64,0.010161985223126748,0.062324963372413354,4,10,8,22.0,42.0,,,SGD,1.1740065908431635e-05,57.0,1629.0716552734375,1549.0,COMPLETE
57,3212.131103515625,2026-03-24 00:34:30.441498,2026-03-24 00:34:31.939135,0 days 00:00:01.497637,64,0.0034799840620161216,0.07088711910136603,2,23,17,,,,,RMSprop,2.7332256473480588e-05,,,,PRUNED
58,2192.12939453125,2026-03-24 00:34:31.950494,2026-03-24 00:34:52.958033,0 days 00:00:21.007539,16,0.021433217924497424,0.09747754551137837,3,42,39,19.0,,,,SGD,2.1935037321535384e-05,,,,PRUNED
59,1508.1197509765625,2026-03-24 00:34:52.975064,2026-03-24 00:35:02.867414,0 days 00:00:09.892350,64,0.016221495823214166,0.07661539808914744,4,50,27,40.0,30.0,,,SGD,3.413992084143988e-05,106.0,1508.1197509765625,4502.0,COMPLETE
60,1477.125244140625,2026-03-24 00:35:02.883632,2026-03-24 00:35:14.914038,0 days 00:00:12.030406,64,0.008408988105420494,0.09282450122949142,3,31,23,46.0,,,,SGD,4.770882606276823e-05,192.0,1477.125244140625,2366.0,COMPLETE
61,1485.9742431640625,2026-03-24 00:35:14.931403,2026-03-24 00:35:25.999450,0 days 00:00:11.068047,64,0.00610172690974148,0.09984036988304139,3,25,51,26.0,,,,SGD,7.621308552157394e-05,162.0,1485.9742431640625,3134.0,COMPLETE
62,1491.8026123046875,2026-03-24 00:35:26.018386,2026-03-24 00:35:36.425952,0 days 00:00:10.407566,64,0.013149599669971144,0.09681126531996401,3,14,57,34.0,,,,SGD,5.654985531864095e-05,142.0,1491.8026123046875,3198.0,COMPLETE
63,1542.239013671875,2026-03-24 00:35:36.442497,2026-03-24 00:35:43.720341,0 days 00:00:07.277844,64,0.0035131979969461715,0.08847065698688822,3,36,54,24.0,,,,SGD,3.005212617498197e-05,93.0,1542.239013671875,3895.0,COMPLETE
64,1586.4495849609375,2026-03-24 00:35:43.735293,2026-03-24 00:35:50.766119,0 days 00:00:07.030826,64,0.009046818835846083,0.09297322188838086,5,17,62,8.0,21.0,24.0,,SGD,4.5633286672977635e-05,69.0,1586.4495849609375,2779.0,COMPLETE
65,9267.603515625,2026-03-24 00:35:50.784658,2026-03-24 00:35:52.576553,0 days 00:00:01.791895,64,0.01873317747264366,0.028314306591418724,3,27,43,18.0,,,,Adam,1.661244192435046e-05,,,,PRUNED
66,1754.2655029296875,2026-03-24 00:35:52.589804,2026-03-24 00:36:03.404115,0 days 00:00:10.814311,64,0.027386095291495317,0.09767865854113576,2,20,64,,,,,SGD,3.732421110063513e-05,,,,PRUNED
67,1955.020751953125,2026-03-24 00:36:03.419869,2026-03-24 00:36:07.356300,0 days 00:00:03.936431,64,0.058919637758522235,0.08508285434273218,3,8,30,24.0,,,,SGD,5.947493402382142e-05,,,,PRUNED
68,1673.5369873046875,2026-03-24 00:36:07.375537,2026-03-24 00:36:17.656735,0 days 00:00:10.281198,32,0.032009097291940965,0.08118511813085905,4,11,20,28.0,11.0,,,RMSprop,0.0001125113927086031,54.0,1673.5369873046875,1398.0,COMPLETE
69,1422.9970703125,2026-03-24 00:36:17.673082,2026-03-24 00:36:26.916773,0 days 00:00:09.243691,64,0.0017365603947525146,0.08901535353952443,3,30,52,30.0,,,,SGD,2.334875252891653e-05,132.0,1422.9970703125,3727.0,COMPLETE
70,1617.3343505859375,2026-03-24 00:36:26.933185,2026-03-24 00:36:45.890713,0 days 00:00:18.957528,16,0.0017502679425818127,0.08840564598498273,3,39,52,35.0,,,,SGD,2.329019168750399e-05,97.0,1617.3343505859375,4574.0,COMPLETE
71,1531.4814453125,2026-03-24 00:36:45.908140,2026-03-24 00:36:51.681274,0 days 00:00:05.773134,64,0.006986691538780917,0.09446427580438593,3,29,55,29.0,,,,SGD,2.8441447201740843e-05,60.0,1531.4814453125,3791.0,COMPLETE
72,1436.9285888671875,2026-03-24 00:36:51.695782,2026-03-24 00:37:02.049291,0 days 00:00:10.353509,64,0.0001261900192252859,0.09704306204845406,3,34,58,30.0,,,,SGD,3.4180521617308674e-05,158.0,1436.9285888671875,4381.0,COMPLETE
73,1418.8607177734375,2026-03-24 00:37:02.065690,2026-03-24 00:37:08.660714,0 days 00:00:06.595024,64,0.0009187599044764422,0.09085545360498445,3,34,50,30.0,,,,SGD,3.3803391638564415e-05,78.0,1418.8607177734375,3845.0,COMPLETE
74,1462.282470703125,2026-03-24 00:37:08.677114,2026-03-24 00:37:20.306626,0 days 00:00:11.629512,64,2.5431799204937873e-05,0.08976507895819168,3,31,58,39.0,,,,SGD,3.394066564446852e-05,161.0,1462.282470703125,4732.0,COMPLETE
75,1434.62451171875,2026-03-24 00:37:20.852295,2026-03-24 00:37:36.746560,0 days 00:00:15.894265,64,0.003407103808928013,0.09184067893177869,6,35,47,30.0,29.0,63.0,34.0,SGD,4.2724287216205876e-05,168.0,1434.62451171875,8923.0,COMPLETE
76,1473.2476806640625,2026-03-24 00:37:36.763069,2026-03-24 00:37:45.150306,0 days 00:00:08.387237,64,0.0030846698296616687,0.09202232059093982,6,35,48,31.0,28.0,61.0,32.0,SGD,3.069916875220052e-05,69.0,1473.2476806640625,8714.0,COMPLETE
77,1481.703125,2026-03-24 00:37:45.166086,2026-03-24 00:38:01.302784,0 days 00:00:16.136698,64,0.0059219291875155095,0.08474044995859302,6,33,50,29.0,37.0,52.0,52.0,SGD,4.062202251937288e-05,171.0,1481.703125,9877.0,COMPLETE
78,1536.63671875,2026-03-24 00:38:01.449959,2026-03-24 00:38:13.637990,0 days 00:00:12.188031,64,0.0014742076298986054,0.09550347919779514,6,38,46,31.0,32.0,38.0,21.0,SGD,2.604826772868787e-05,128.0,1536.63671875,7124.0,COMPLETE
79,1590.701904296875,2026-03-24 00:38:13.655658,2026-03-24 00:38:23.660181,0 days 00:00:10.004523,64,0.010265855123161092,0.09090555975347772,6,35,55,26.0,43.0,30.0,45.0,Adam,1.865723498936183e-05,62.0,1590.701904296875,8141.0,COMPLETE
80,1396.21630859375,2026-03-24 00:38:23.679466,2026-03-24 00:38:40.754810,0 days 00:00:17.075344,64,0.00548061245548463,0.08816515664415472,5,30,52,22.0,40.0,45.0,,SGD,4.3071895383397215e-05,148.0,1396.21630859375,6237.0,COMPLETE
81,1340.6695556640625,2026-03-24 00:38:40.771125,2026-03-24 00:39:03.499780,0 days 00:00:22.728655,64,0.005037926450941474,0.08699503844095463,5,31,52,20.0,41.0,45.0,,SGD,4.285873095742989e-05,204.0,1340.6695556640625,6178.0,COMPLETE
82,1408.603271484375,2026-03-24 00:39:03.549788,2026-03-24 00:39:16.092352,0 days 00:00:12.542564,64,0.004740286888337662,0.08272820386349436,5,30,52,23.0,40.0,45.0,,SGD,4.317027015964071e-05,100.0,1408.603271484375,6332.0,COMPLETE
83,1379.9959716796875,2026-03-24 00:39:16.110284,2026-03-24 00:39:31.141148,0 days 00:00:15.030864,64,0.004852127594332245,0.08209056280951854,5,30,52,20.0,40.0,44.0,,SGD,5.169988826773918e-05,157.0,1379.9959716796875,6003.0,COMPLETE
84,1452.0035400390625,2026-03-24 00:39:31.159213,2026-03-24 00:39:42.205945,0 days 00:00:11.046732,64,0.005757475724430518,0.08138786034253473,5,31,52,20.0,40.0,45.0,,SGD,5.12642185340592e-05,95.0,1452.0035400390625,6110.0,COMPLETE
85,1469.490478515625,2026-03-24 00:39:42.228260,2026-03-24 00:39:54.690289,0 days 00:00:12.462029,64,0.008441286691165903,0.08746165598256485,5,30,53,23.0,44.0,44.0,,SGD,6.364845378924586e-05,113.0,1469.490478515625,6624.0,COMPLETE
86,1495.6798095703125,2026-03-24 00:39:54.709097,2026-03-24 00:40:04.731922,0 days 00:00:10.022825,64,0.004739259018871916,0.07756606875841777,5,26,50,17.0,38.0,52.0,,SGD,4.9440898007494254e-05,93.0,1495.6798095703125,5582.0,COMPLETE
87,1494.58544921875,2026-03-24 00:40:04.748760,2026-03-24 00:40:20.624057,0 days 00:00:15.875297,32,0.0024272240650568657,0.08297058280317145,5,29,54,22.0,35.0,41.0,,SGD,4.2081328810649775e-05,92.0,1494.58544921875,5776.0,COMPLETE
88,1411.0736083984375,2026-03-24 00:40:20.642671,2026-03-24 00:40:46.404448,0 days 00:00:25.761777,64,0.01520501800262255,0.08523692178192697,5,33,51,20.0,45.0,48.0,,SGD,8.584790798699164e-05,287.0,1411.0736083984375,6667.0,COMPLETE
89,1419.8204345703125,2026-03-24 00:40:46.428221,2026-03-24 00:41:10.454526,0 days 00:00:24.026305,64,0.013997920862396781,0.07995949435085949,5,24,51,20.0,45.0,48.0,,RMSprop,8.506688498034016e-05,181.0,1419.8204345703125,6109.0,COMPLETE
90,1425.03662109375,2026-03-24 00:41:10.474657,2026-03-24 00:41:31.088433,0 days 00:00:20.613776,64,0.013720079486166974,0.07297004522463714,5,33,44,20.0,45.0,49.0,,RMSprop,8.239519261794216e-05,161.0,1425.03662109375,6324.0,COMPLETE
91,1469.7242431640625,2026-03-24 00:41:31.109297,2026-03-24 00:41:47.978677,0 days 00:00:16.869380,64,0.01579589772754845,0.08588610517191109,5,27,56,19.0,40.0,47.0,,RMSprop,9.09607322867396e-05,113.0,1469.7242431640625,6047.0,COMPLETE
92,1558.3668212890625,2026-03-24 00:41:47.997345,2026-03-24 00:41:57.840953,0 days 00:00:09.843608,64,0.01136102004960551,0.079558330887037,5,24,51,17.0,41.0,55.0,,RMSprop,6.82368074381292e-05,52.0,1558.3668212890625,5855.0,COMPLETE
93,1574.5693359375,2026-03-24 00:41:57.858431,2026-03-24 00:42:08.049596,0 days 00:00:10.191165,64,0.007282139213105951,0.08231173188776983,5,37,49,23.0,51.0,42.0,,RMSprop,0.0001320950776444355,53.0,1574.5693359375,7200.0,COMPLETE
94,1641.191162109375,2026-03-24 00:42:08.068870,2026-03-24 00:42:16.352207,0 days 00:00:08.283337,64,0.009895361762186517,0.08441263186038474,5,28,54,22.0,46.0,46.0,,RMSprop,0.00016238274013150072,29.0,1641.191162109375,6687.0,COMPLETE
